name,price,weight,brand,link
"Маасдам Viola, полутвёрдый, 45%, нарезка",229,120 г,Viola,https://samokat.ru/product/b2140f2e-6100-11ed-ae75-08c0eb320147
"Сыр Laplandia, Лёгкий, полутвёрдый, нарезка, 17%",275,120 г,Laplandia,https://samokat.ru/product/4091f76c-5776-11ec-a0ee-ec0d9a21b021
"Тильзитер Ламбер, 50%, нарезка",315,150 г,Ламбер,https://samokat.ru/product/f005d2a1-e323-11eb-a0ee-ec0d9a21b021
"Сыр Laplandia, Лёгкий, полутвёрдый, нарезка, 17%",275,120 г,Laplandia,https://samokat.ru/product/4091f76c-5776-11ec-a0ee-ec0d9a21b021
"Сыр Laplandia, полутвёрдый, сливочный, нарезка, 45%",279,130 г,Laplandia,https://samokat.ru/product/3359ca4d-a09a-11ed-885d-08c0eb32014b
"Сыр Natura, полутвёрдый, сливочный, нарезка, 45%",280,150 г,Natura,https://samokat.ru/product/55d7b338-c17a-11ed-b970-08c0eb32008b
"Маасдам Viola, полутвёрдый, 45%, нарезка",229,120 г,Viola,https://samokat.ru/product/b2140f2e-6100-11ed-ae75-08c0eb320147
"Сыр Ламбер, Гурмэ, полутвёрдый, 55%",369,230 г,Ламбер,https://samokat.ru/product/22e8a185-cf28-11ef-aa3a-be3af2b6059f
"Тильзитер Ламбер, 50%, нарезка",315,150 г,Ламбер,https://samokat.ru/product/f005d2a1-e323-11eb-a0ee-ec0d9a21b021
"Сыр Ламбер, полутвёрдый, 50%",315,230 г,Ламбер,https://samokat.ru/product/b1464c0f-ef08-11e8-80c5-0cc47a817925
"Пармезан Natura Selection, Classical, твёрдый, 45%",399,150 г,Natura,https://samokat.ru/product/e7448db1-0595-11f0-a5c9-7cc255b74513
"Тильзитер Natura, полутвёрдый, 45%",249,180 г,Natura,https://samokat.ru/product/ea80e731-ff4e-11ef-a5c9-7cc255b74513
"Сыр Ламбер, полутвёрдый, халяль, 50%",749,575-600 г,Ламбер,https://samokat.ru/product/0bc58111-f48e-11ed-ae78-08c0eb320147
"Пармезан Dolce Granto, твёрдый, 40%",525,200 г,Dolce Granto,https://samokat.ru/product/f0481f69-37a0-11ea-b723-0050560306e1
"Сыр грюнландер Hochland, полутвёрдый, 50%",632,400 г,Hochland,https://samokat.ru/product/c8cc2361-f081-11eb-a0ee-ec0d9a21b021
"Сыр Laplandia, Лёгкий, полутвёрдый, нарезка, 17%",275,120 г,Laplandia,https://samokat.ru/product/4091f76c-5776-11ec-a0ee-ec0d9a21b021
"Сыр Laplandia, полутвёрдый, сливочный, нарезка, 45%",279,130 г,Laplandia,https://samokat.ru/product/3359ca4d-a09a-11ed-885d-08c0eb32014b
"Сыр Natura, полутвёрдый, сливочный, нарезка, 45%",280,150 г,Natura,https://samokat.ru/product/55d7b338-c17a-11ed-b970-08c0eb32008b
"Сыр Natura, полутвёрдый, 45%",409,250 г,Natura,https://samokat.ru/product/68d200fb-0857-11ef-b973-08c0eb32008b
"Маасдам Viola, полутвёрдый, 45%, нарезка",229,120 г,Viola,https://samokat.ru/product/b2140f2e-6100-11ed-ae75-08c0eb320147
"Сыр Mlekara Sabac, крем-чиз, мягкий, сливочный, 60%",155,100 г,Mlekara Sabac,https://samokat.ru/product/c8721b71-5af9-11ef-8861-08c0eb32014b
"Сыр Сербская брынза Mlekara Sabac, мягкий, с сывороткой, 40%",289,200 г,Mlekara Sabac,https://samokat.ru/product/c16620dd-f06d-11ef-9bb0-be3af2b6059f
"Моцарелла Pretto, 45%",469,370 г,Pretto,https://samokat.ru/product/54caa078-0a17-11f0-aa3a-be3af2b6059f
"Плавленый сыр Hochland, Чизбургер, 50%",249,200 г,Hochland,https://samokat.ru/product/aeac5b14-ef99-11ef-aa3a-be3af2b6059f
"Плавленый сыр Hochland, Фетакса, 45%",225,200 г,Hochland,https://samokat.ru/product/586d6493-0a86-11e9-80c5-0cc47a817925
"Плавленый сыр Viola, сливочный, 35%",155,130 г,Viola,https://samokat.ru/product/074da606-e461-11ef-aa23-be3af2b6059f
"Творожный сыр Hochland Almette, с изысканным розмарином, 60%",205,150 г,Hochland,https://samokat.ru/product/832fb4f0-1755-11ef-ae7a-08c0eb320147
"Сыр Mlekara Sabac, крем-чиз, мягкий, сливочный, 60%",155,100 г,Mlekara Sabac,https://samokat.ru/product/c8721b71-5af9-11ef-8861-08c0eb32014b
"Сыр Mlekara Sabac Cream Cheese, мягкий, сливочный, 60%",299,250 г,Mlekara Sabac,https://samokat.ru/product/4823d38a-114c-11f0-aa25-be3af2b6059f
"Маскарпоне Pretto, мягкий, 80%",374,250 г,Pretto,https://samokat.ru/product/1eb48831-019f-11eb-8599-1c34dae33151
"Творожный сыр Pretto, 65%",179,140 г,Pretto,https://samokat.ru/product/3ffa3460-ef64-11ef-aa23-be3af2b6059f
"Творожный сыр Viola, с вялеными томатами и итальянскими травами, 64%",159,140 г,Viola,https://samokat.ru/product/5c73f4bc-6c4b-11ef-b10b-08c0eb31fffb
"Плавленый сыр Hochland, Фетакса, 45%",225,200 г,Hochland,https://samokat.ru/product/586d6493-0a86-11e9-80c5-0cc47a817925
"Мини-моцарелла Bonfesto, мягкая, 45%",182,80 г,Bonfesto,https://samokat.ru/product/bceea70a-799b-11ef-b973-08c0eb32008b
"Моцарелла Galbani, мягкая, 45%",255,125 г,Galbani,https://samokat.ru/product/b1464c1a-ef08-11e8-80c5-0cc47a817925
"Моцарелла Unagrande, без лактозы, протеиновая, мягкая, палочки, 35%",219,120 г,Unagrande,https://samokat.ru/product/2db3dbb6-81a0-11ef-b10b-08c0eb31fffb
"Моцарелла Unagrande, без лактозы, протеиновая, мягкая, палочки, 35%",219,120 г,Unagrande,https://samokat.ru/product/2db3dbb6-81a0-11ef-b10b-08c0eb31fffb
